portfolioId,Ticker,Name,NAV,ChangePercent,ChangePercentYTD,Ccy,1Y,Incept
286269,DXG,Dynamic iShares Active Global Dividend ETF,22.02,1.69,-,Canadian Dollar,-,6.76
283155,XMY,iShares Edge MSCI Min Vol Global Index ETF (CAD-Hedged),21.52,0.79,-,Canadian Dollar,-,-
239754,CWW.A,iShares Global Water Index ETF,32.43,1.41,8.01,Canadian Dollar,14.06,73.82
239417,CLG.A,iShares 1-10 Year Laddered Government Bond Index ETF,19.02,-0.08,0.60,Canadian Dollar,-0.24,11.61
239432,XQB.A,iShares Core High Quality Canadian Bond Index ETF,20.83,-0.10,0.93,Canadian Dollar,0.75,23.92
239415,CBH.A,iShares 1-10 Year Laddered Corporate Bond Index ETF,19.42,-0.08,1.30,Canadian Dollar,2.12,17.97
239553,CIF.A,iShares Global Infrastructure Index ETF,27.17,0.73,6.14,Canadian Dollar,21.33,55.30
239469,CBQ.A,iShares BRIC Index ETF,21.55,1.23,13.15,Canadian Dollar,19.67,26.24
239473,CWO.A,iShares Emerging Markets Fundamental Index ETF,35.26,1.11,7.40,Canadian Dollar,30.78,92.43
239413,CMR.A,iShares Premium Money Market ETF,50.01,0.00,0.04,Canadian Dollar,0.15,5.27
239434,CVD.A,iShares Convertible Bond Index ETF,18.90,0.02,1.43,Canadian Dollar,7.98,22.46
239557,CGR.A,iShares Global Real Estate Index ETF,29.08,-0.61,1.77,Canadian Dollar,2.10,70.63
239575,CJP.A,iShares Japan Fundamental Index ETF (CAD-Hedged),13.39,0.88,0.11,Canadian Dollar,15.92,-27.09
251816,BOVA11,iShares Ibovespa Fundo de Índice,62.31,1.02,7.79,Brazilian Real,29.33,71.81
251902,IVVB11,iShares S&P 500 FI em Cotas de Fundo de Índice - Inv. no Exterior,77.26,0.16,2.41,Brazilian Real,3.33,84.92
251711,ECOO11,iShares Índice Carbono Eficiente (ICO2) Brasil Fundo de Índice,73.70,1.16,9.21,Brazilian Real,22.32,46.71
251752,SMAL11,iShares BM&FBOVESPA Small Cap Fundo de Índice,63.12,0.14,16.14,Brazilian Real,42.31,164.66
251817,BRAX11,iShares IBrX-Índice Brasil (IBrX-100) Fundo de Índice,52.46,0.94,8.04,Brazilian Real,29.46,24.67
275304,IVV,iShares S&P 500 ETF,315.34,0.50,0.67,Australian Dollar,18.10,68.12
273432,IVE,iShares MSCI EAFE ETF,83.78,1.95,1.78,Australian Dollar,12.54,45.38
273425,IJH,iShares S&P Mid-Cap ETF,228.81,0.56,-1.36,Australian Dollar,21.82,244.34
275305,IRU,iShares Russell 2000 ETF,183.63,0.72,-2.73,Australian Dollar,27.31,174.05
273417,IEM,iShares MSCI Emerging Markets ETF,52.51,0.43,5.66,Australian Dollar,17.53,244.84
273426,IJR,iShares S&P Small-Cap ETF,92.14,0.67,-4.05,Australian Dollar,25.61,283.88
273434,IJP,iShares MSCI Japan ETF,68.23,-0.35,-0.94,Australian Dollar,14.87,7.91
273437,ITW,iShares MSCI Taiwan Capped ETF,43.80,-0.18,6.07,Australian Dollar,23.10,-1.62
273436,IKO,iShares MSCI South Korea Capped ETF,81.52,0.45,10.15,Australian Dollar,19.49,170.91
273424,IZZ,iShares China Large-Cap ETF,50.38,-0.26,3.53,Australian Dollar,17.43,161.69
273427,IEU,iShares Europe ETF,56.86,3.20,1.84,Australian Dollar,10.57,23.60
273433,IHK,iShares MSCI Hong Kong ETF,29.50,-0.46,7.54,Australian Dollar,17.06,217.97
273428,IOO,iShares Global 100 ETF,109.01,1.51,0.86,Australian Dollar,17.64,15.48
273430,IXJ,iShares Global Healthcare ETF,136.45,0.71,2.85,Australian Dollar,9.43,79.91
273429,IXI,iShares Global Consumer Staples ETF,134.09,0.90,2.04,Australian Dollar,5.05,142.71
273435,ISG,iShares MSCI Singapore Capped ETF,29.93,-0.02,7.67,Australian Dollar,10.11,76.71
251852,IOZ,iShares Core S&P/ASX 200 ETF,24.12,0.30,4.78,Australian Dollar,20.33,63.12
273416,IAA,iShares Asia 50 ETF,69.33,0.04,6.83,Australian Dollar,24.42,55.34
273431,IXP,iShares Global Telecom ETF,78.37,0.42,-4.29,Australian Dollar,-0.08,41.58
251977,IAF,iShares Core Composite Bond ETF,106.07,-0.16,1.21,Australian Dollar,1.94,27.29
273392,IBK,iShares MSCI BRIC ETF,48.05,0.35,5.81,Australian Dollar,23.54,-11.07
251921,ILC,iShares S&P/ASX 20 ETF,24.08,0.34,4.93,Australian Dollar,21.59,62.63
251922,IHD,iShares S&P/ASX Dividend Opportunities ETF,14.26,0.42,5.83,Australian Dollar,19.50,40.07
271027,IHVV,iShares S&P 500 AUD Hedged ETF,301.01,-0.26,5.95,Australian Dollar,18.00,27.74
251978,ILB,iShares Government Inflation ETF,115.10,-0.14,1.15,Australian Dollar,0.40,22.43
251923,ISO,iShares S&P/ASX Small Ordinaries ETF,4.32,0.15,1.43,Australian Dollar,13.16,3.28
275246,IHCB,iShares Core Global Corporate Bond (AUD Hedged) ETF,105.32,0.19,1.31,Australian Dollar,4.27,8.02
251979,IGB,iShares Treasury ETF,103.19,-0.26,1.15,Australian Dollar,1.11,22.97
271031,IHOO,iShares Global 100 AUD Hedged ETF,109.74,-0.10,5.67,Australian Dollar,21.30,25.84
275248,IHHY,iShares Global High Yield Bond (AUD Hedged) ETF,106.92,0.09,2.04,Australian Dollar,13.28,14.20
284665,WDMF,iShares Edge MSCI World Multifactor ETF,27.71,0.03,0.87,Australian Dollar,-,9.44
284667,WVOL,iShares Edge MSCI World Minimum Volatility ETF,26.59,0.00,0.10,Australian Dollar,-,4.64
283117,IWLD,iShares Core MSCI World All Cap ETF,28.54,0.04,0.51,Australian Dollar,-,13.95
284666,MVOL,iShares Edge MSCI Australia Minimum Volatility ETF,27.10,0.25,4.83,Australian Dollar,-,7.79
284664,AUMF,iShares Edge MSCI Australia Multifactor ETF,26.91,0.21,4.61,Australian Dollar,-,7.82
275254,IHEB,iShares J.P. Morgan USD Emerging Markets Bond (AUD Hedged) ETF,106.63,0.25,3.78,Australian Dollar,8.76,13.77
283119,IHWL,iShares Core MSCI World All Cap (AUD Hedged) ETF,29.14,0.01,5.30,Australian Dollar,-,16.42
287042,ISEC,iShares Enhanced Cash ETF,-,-,-,Australian Dollar,-,-
287045,ISCH,iShares Core Cash ETF,-,-,-,Australian Dollar,-,-
286096,RBACASH,RBA Cash,-,-,-,Australian Dollar,-,-
