portfolioId,Ticker,Name,NAV,ChangePercent,ChangePercentYTD,Ccy,1Y,Incept
251725,IEAG,iShares  Aggregate Bond UCITS ETF EUR (Dist),120.98,0.04,-0.97,Euro,-0.72,44.41
251736,IBGX,iShares  Govt Bond 3-5yr UCITS ETF EUR (Dist),168.80,0.20,-0.42,Euro,0.16,50.23
251730,EEX5,iShares  Corp Bond ex-Financials 1-5yr UCITS ETF EUR (Dist),109.66,-0.19,-0.03,Euro,1.24,26.22
251729,EEXF,iShares  Corp Bond ex-Financials UCITS ETF EUR (Dist),116.70,-0.34,0.01,Euro,2.01,40.65
254531,EMBE,iShares J.P. Morgan $ EM Bond EUR Hedged UCITS ETF (Dist),101.38,0.08,3.41,Euro,6.31,21.77
251780,EXSI,iShares EURO STOXX UCITS ETF (DE),38.27,3.67,7.12,Euro,20.58,98.47
251784,EXX1,iShares EURO STOXX Banks 30-15 UCITS ETF (DE),13.60,7.36,8.68,Euro,30.92,-36.70
251808,IPRP,iShares European Property Yield UCITS ETF EUR (Dist),38.65,1.23,1.48,Euro,2.47,125.06
287343,CEUD,iShares MSCI EMU UCITS ETF EUR (Dist),105.67,0.47,-,Euro,-,-
251732,IRCP,iShares  Corp Bond Interest Rate Hedged UCITS ETF EUR (Dist),97.28,0.27,0.01,Euro,0.82,4.41
254572,CRPH,iShares Global Corp Bond EUR Hedged UCITS ETF (Dist),104.65,-0.20,0.74,Euro,2.06,15.01
251739,IBCI,iShares  Inflation Linked Govt Bond UCITS ETF EUR (Acc),203.28,0.65,-2.75,Euro,-0.38,29.09
251733,IBGS,iShares  Govt Bond 1-3yr UCITS ETF EUR (Dist),144.15,0.07,-0.22,Euro,0.04,33.20
251842,ICOV,iShares  Covered Bond UCITS ETF EUR (Dist),154.78,-0.17,0.00,Euro,0.27,50.05
251973,ISPA,iShares STOXX Global Select Dividend 100 UCITS ETF (DE),28.20,0.05,3.70,Euro,17.65,143.96
251381,MVEU,iShares Edge MSCI Europe Minimum Volatility UCITS ETF EUR (Acc),40.46,1.23,5.84,Euro,7.94,60.08
251740,IEGA,iShares Core  Govt Bond UCITS ETF EUR (Dist),121.84,0.20,-1.55,Euro,-1.85,42.51
251787,IDVY,iShares Euro Dividend UCITS ETF EUR (Dist),23.09,3.83,5.28,Euro,20.96,59.93
251778,EXHE,iShares Pfandbriefe UCITS ETF (DE),105.14,-0.19,-0.21,Euro,-0.14,43.23
251929,EUN,iShares STOXX Europe 50 UCITS ETF EUR (Dist),32.53,2.06,6.01,Euro,17.79,3.42
251772,EXXY,iShares Diversified Commodity Swap UCITS ETF (DE),19.32,-1.79,-3.85,Euro,14.75,-38.63
253496,CSEMUS,iShares MSCI EMU Small Cap UCITS ETF EUR (Acc),183.23,2.58,9.02,Euro,18.81,175.11
251946,EXV4,iShares STOXX Europe 600 Health Care UCITS ETF (DE),75.72,0.69,7.70,Euro,11.81,130.54
251891,IWDE,iShares MSCI World EUR Hedged UCITS ETF (Acc),46.04,1.42,5.05,Euro,15.73,84.23
251788,EXSG,iShares EURO STOXX Select Dividend 30 UCITS ETF (DE),21.19,3.83,5.06,Euro,21.58,83.38
251954,EXH1,iShares STOXX Europe 600 Oil & Gas UCITS ETF (DE),31.24,1.56,-2.17,Euro,26.08,48.69
251763,EXSB,iShares DivDAX® UCITS ETF (DE),17.47,3.27,5.59,Euro,25.25,172.53
251789,DJSC,iShares EURO STOXX Small UCITS ETF EUR (Dist),33.40,3.00,9.36,Euro,18.42,147.60
251934,EXV1,iShares STOXX Europe 600 Banks UCITS ETF (DE),18.57,4.76,6.27,Euro,29.36,-25.56
251861,SMEA,iShares MSCI Europe UCITS ETF EUR (Acc),48.31,2.14,5.94,Euro,17.00,91.54
251747,SITB,iShares Italy Govt Bond UCITS ETF EUR (Dist),155.61,0.51,-2.02,Euro,-3.88,38.33
272058,IEVL,iShares Edge MSCI Europe Value Factor UCITS ETF EUR (Acc),5.78,2.93,5.32,Euro,21.03,12.82
251786,DJMC,iShares EURO STOXX Mid UCITS ETF EUR (Dist),57.20,3.14,8.02,Euro,22.01,168.44
272249,IEBB,iShares  Corp Bond BBB-BB UCITS ETF EUR (Dist),5.06,-0.11,0.59,Euro,3.81,4.27
251971,EXSH,iShares STOXX Europe Select Dividend 30 UCITS ETF (DE),17.05,1.82,2.25,Euro,13.66,42.01
251972,EXSE,iShares STOXX Europe Small 200 UCITS ETF (DE),28.09,1.57,7.93,Euro,15.58,164.04
251805,IMIB,iShares FTSE MIB UCITS ETF EUR (Dist),12.46,5.20,6.84,Euro,17.18,-35.48
251975,EXS2,iShares TecDAX® UCITS ETF (DE),19.14,2.34,12.94,Euro,25.89,40.75
280851,SUSE,iShares  Corp Bond Sustainability Screened 0-3yr UCITS ETF EUR (Dist),5.01,-0.09,-0.02,Euro,0.33,0.67
251735,IBGL,iShares  Govt Bond 15-30yr UCITS ETF EUR (Dist),227.17,0.14,-3.72,Euro,-5.64,91.09
251738,IBGM,iShares  Govt Bond 7-10yr UCITS ETF EUR (Dist),208.02,0.38,-1.41,Euro,-1.39,79.05
251967,EXH9,iShares STOXX Europe 600 Utilities UCITS ETF (DE),28.81,1.90,6.48,Euro,6.61,112.18
251773,EXHA,iShares eb.rexx® Government Germany UCITS ETF (DE),141.50,-0.44,-0.50,Euro,0.01,66.68
251936,EXV6,iShares STOXX Europe 600 Basic Resources UCITS ETF (DE),41.52,0.85,6.33,Euro,59.52,130.92
253458,CSBGE7,iShares  Govt Bond 3-7yr UCITS ETF EUR (Acc),132.46,0.16,-0.71,Euro,-0.45,32.07
251749,SESP,iShares Spain Govt Bond UCITS ETF EUR (Dist),160.93,0.48,-0.84,Euro,0.56,44.05
251764,EXXW,iShares Dow Jones Asia Pacific Select Dividend 30 UCITS ETF (DE),32.46,-0.92,6.89,Euro,30.28,132.77
251834,EXHF,iShares Euro Government Bond Capped 1.5-10.5yr UCITS ETF (DE),120.69,0.14,-1.04,Euro,-0.79,61.23
251774,EXHB,iShares eb.rexx® Government Germany 1.5-2.5yr UCITS ETF (DE),89.31,-0.17,-0.28,Euro,-0.29,27.80
251963,EXV2,iShares STOXX Europe 600 Telecommunications UCITS ETF (DE),28.65,1.87,3.48,Euro,-3.18,24.61
251970,EXSD,iShares STOXX Europe Mid 200 UCITS ETF (DE),45.31,1.82,7.07,Euro,15.66,163.75
251712,IAEX,iShares AEX UCITS ETF EUR (Dist),52.56,2.31,7.38,Euro,21.24,68.65
251737,IEGY,iShares  Govt Bond 5-7yr UCITS ETF EUR (Dist),154.40,0.18,-0.95,Euro,-0.93,37.95
251779,EXVM,iShares eb.rexx® Money Market UCITS ETF (DE),80.50,-0.04,-0.31,Euro,-0.72,4.01
251930,EXW3,iShares STOXX Europe 50 UCITS ETF (DE),31.95,2.05,6.06,Euro,17.99,12.46
277248,IFSE,iShares Edge MSCI Europe Multifactor UCITS ETF EUR (Acc),5.71,1.61,6.38,Euro,14.94,14.03
251777,EXHD,iShares eb.rexx® Government Germany 5.5-10.5yr UCITS ETF (DE),142.49,-0.67,-0.53,Euro,-0.16,86.46
251769,EXI2,iShares Dow Jones Global Titans 50 UCITS ETF (DE),32.83,-0.23,4.72,Euro,24.28,45.82
251944,EXH3,iShares STOXX Europe 600 Food & Beverage UCITS ETF (DE),64.68,1.21,5.25,Euro,4.96,254.25
251767,IESE,iShares MSCI Europe SRI UCITS ETF EUR (Acc),39.88,1.83,6.56,Euro,16.20,55.80
257270,EMUM,iShares MSCI EMU Mid Cap UCITS ETF EUR (Acc),36.93,3.07,7.79,Euro,18.03,44.24
251743,SFRB,iShares France Govt Bond UCITS ETF EUR (Dist),146.82,0.91,-2.33,Euro,-2.84,19.92
251950,EXH5,iShares STOXX Europe 600 Insurance UCITS ETF (DE),28.44,2.47,3.28,Euro,17.00,83.90
257265,EMUL,iShares MSCI EMU Large Cap UCITS ETF EUR (Acc),35.16,3.73,6.91,Euro,20.43,37.70
251932,EXV5,iShares STOXX Europe 600 Automobiles & Parts UCITS ETF (DE),55.52,2.88,5.69,Euro,17.61,251.29
251706,EXXV,iShares Dow Jones Eurozone Sustainability Screened UCITS ETF (DE),13.06,3.75,7.67,Euro,25.63,44.78
251776,EXHC,iShares eb.rexx® Government Germany 2.5-5.5yr UCITS ETF (DE),108.24,-0.32,-0.43,Euro,0.09,49.40
253273,EUCF,iShares  Corp Bond Financials UCITS ETF EUR (Dist),105.96,-0.16,0.56,Euro,2.85,13.06
253455,CSBGE3,iShares  Govt Bond 1-3yr UCITS ETF EUR (Acc),111.96,0.07,-0.21,Euro,0.04,11.90
253717,CSMIB,iShares FTSE MIB UCITS ETF EUR (Acc),73.58,5.20,6.82,Euro,17.12,11.70
251940,EXV8,iShares STOXX Europe 600 Construction & Materials UCITS ETF (DE),47.05,3.45,8.71,Euro,22.42,231.50
251948,EXH4,iShares STOXX Europe 600 Industrial Goods & Services UCITS ETF (DE),52.00,2.58,8.11,Euro,21.25,216.15
251835,EXHG,iShares Euro Government Bond Capped 1.5-2.5yr UCITS ETF (DE),95.59,0.02,-0.31,Euro,-0.18,27.71
251956,EXH7,iShares STOXX Europe 600 Personal & Household Goods UCITS ETF (DE),87.72,1.33,12.33,Euro,17.64,328.67
261152,CSGLDE,iShares Gold EUR Hedged (CH),79.17,-1.01,6.90,Euro,-1.52,13.10
251938,EXV7,iShares STOXX Europe 600 Chemicals UCITS ETF (DE),91.27,2.95,5.73,Euro,18.93,320.87
251741,IEGE,iShares  Govt Bond 0-1yr UCITS ETF EUR (Dist),99.96,-0.01,-0.23,Euro,-0.54,3.58
251958,EXI5,iShares STOXX Europe 600 Real Estate UCITS ETF (DE),17.73,0.69,1.19,Euro,-1.93,5.08
251792,IDJG,iShares Euro Total Market Growth Large UCITS ETF EUR (Dist),35.70,3.00,7.67,Euro,15.21,80.98
251791,EXX2,iShares EURO STOXX Telecommunications 30-15 UCITS ETF (DE),35.86,3.10,5.71,Euro,5.92,3.84
251961,EXV3,iShares STOXX Europe 600 Technology UCITS ETF (DE),40.06,2.04,13.11,Euro,25.80,-5.03
251793,IDJV,iShares Euro Total Market Value Large UCITS ETF EUR (Dist),23.61,4.63,7.79,Euro,26.83,45.26
251969,EXSC,iShares STOXX Europe Large 200 UCITS ETF (DE),39.22,2.24,5.94,Euro,16.89,98.33
251734,IEGZ,iShares  Govt Bond 10-15yr UCITS ETF EUR (Dist),171.43,0.53,-2.43,Euro,-3.48,70.43
251713,EXXX,iShares ATX UCITS ETF (DE),30.07,3.08,8.19,Euro,27.78,11.70
251838,EXHJ,iShares Euro Government Bond Capped 5.5-10.5yr UCITS ETF (DE),127.74,0.21,-1.20,Euro,-0.93,73.65
258701,EXFN,iShares EURO STOXX 50 ex-Financials UCITS ETF EUR (Acc),34.34,3.38,6.79,Euro,18.74,35.83
272019,IEMO,iShares Edge MSCI Europe Momentum Factor UCITS ETF EUR (Acc),6.06,1.32,6.70,Euro,15.52,19.12
251836,EXHK,iShares Euro Government Bond Capped 10.5+yr UCITS ETF (DE),141.13,0.23,-3.10,Euro,-3.31,100.24
285789,SPME,iShares Edge S&P 500 Minimum Volatility UCITS ETF EUR Hedged (Acc),5.32,0.50,3.54,Euro,-,5.19
253461,CSBGE0,iShares  Govt Bond 7-10yr UCITS ETF EUR (Acc),154.69,0.38,-1.40,Euro,-1.41,53.52
251837,EXHH,iShares Euro Government Bond Capped 2.5-5.5yr UCITS ETF (DE),111.25,0.05,-0.49,Euro,-0.06,43.04
251811,IEUT,iShares FTSEurofirst 100 UCITS ETF EUR (Dist),28.14,2.57,5.76,Euro,19.48,65.73
251775,EXX6,iShares eb.rexx® Government Germany 10.5+yr UCITS ETF (DE),181.79,-1.61,-2.05,Euro,-2.40,102.55
251965,EXV9,iShares STOXX Europe 600 Travel & Leisure UCITS ETF (DE),24.43,1.23,4.90,Euro,3.21,152.60
273016,NK4E,iShares JPX-Nikkei 400 EUR Hedged UCITS ETF (Acc),4.84,0.99,-0.03,Euro,11.37,-2.62
251812,IEUR,iShares FTSEurofirst 80 UCITS ETF EUR (Dist),12.01,3.90,7.59,Euro,21.79,31.23
283568,SUSJ,iShares Sustainable MSCI Japan SRI EUR Hedged UCITS ETF,5.41,1.30,0.34,Euro,-,-
272122,E20Y,iShares  Govt Bond 20yr Target Duration UCITS ETF EUR (Dist),5.05,-0.51,-4.49,Euro,-5.10,0.76
251744,SDEU,iShares Germany Govt Bond UCITS ETF EUR (Dist),139.15,-0.83,-0.79,Euro,-0.77,13.26
251942,EXH2,iShares STOXX Europe 600 Financial Services UCITS ETF (DE),45.86,1.84,8.54,Euro,15.20,187.56
272024,IEQU,iShares Edge MSCI Europe Quality Factor UCITS ETF EUR (Acc),6.02,1.18,6.28,Euro,11.18,17.00
269829,IFRE,iShares MSCI France UCITS ETF EUR (Acc),32.11,4.22,5.81,Euro,20.67,24.47
251719,SBEL,iShares Belgium Govt Bond UCITS ETF EUR (Dist),152.29,0.20,-1.78,Euro,-1.77,26.75
251959,EXH8,iShares STOXX Europe 600 Retail UCITS ETF (DE),31.02,1.45,-0.43,Euro,1.07,95.93
251952,EXH6,iShares STOXX Europe 600 Media UCITS ETF (DE),28.41,1.15,2.42,Euro,1.20,113.38
272016,IESZ,iShares Edge MSCI Europe Size Factor UCITS ETF EUR (Acc),6.27,1.82,7.08,Euro,15.66,21.43
251718,SAUT,iShares Austria Govt Bond UCITS ETF EUR (Dist),145.91,-0.72,-0.89,Euro,-0.47,21.73
282429,3146,iShares DAX Index ETF,1.13,3.38,6.98,Euro,-,19.63
251748,SNLD,iShares Netherlands Govt Bond UCITS ETF EUR (Dist),142.12,-0.67,-0.99,Euro,-0.78,16.87
282361,3155,iShares EURO STOXX 50 Index ETF,1.11,4.01,6.74,Euro,-,16.12
251742,SFIN,iShares Finland Govt Bond UCITS ETF EUR (Dist),140.39,-0.47,-0.81,Euro,-0.19,15.30
287342,IS07,iShares Edge MSCI World Multifactor UCITS ETF EUR Hedged (Acc),5.10,1.32,-,Euro,-,-
287341,SXR0,iShares Edge MSCI World Minimum Volatility UCITS ETF EUR Hedged (Acc),5.04,0.84,-,Euro,-,-
253729,CSEMU,iShares MSCI EMU UCITS ETF EUR (Acc),106.14,-0.05,7.11,Euro,20.16,65.29
251708,ICOLCAP,Fondo Bursátil iShares COLCAP,"13,895.19",0.43,1.03,Colombian Peso,2.38,-17.55
284578,ICOLRISK,Fondo Bursatil iShares MSCI Colombia Risk Weighted,"13,244.70",0.35,-2.29,Colombian Peso,-,-2.81
273830,83162,iShares MSCI China A International Index ETF,6.53,0.29,4.26,Chinese Yuan,8.28,11.38
261154,CSSMI,iShares SMI® (CH),90.54,1.84,6.90,Swiss Franc,14.72,80.08
261155,CSSMIM,iShares SMIM® (CH),237.88,1.13,10.04,Swiss Franc,17.74,217.71
261150,CHCORP,iShares Core CHF Corporate Bond (CH),100.62,-0.35,0.16,Swiss Franc,0.35,5.45
264107,CHSPI,iShares Core SPI® (CH),109.54,1.74,7.47,Swiss Franc,15.75,16.42
261153,CSSLI,iShares SLI® (CH),148.38,2.00,7.15,Swiss Franc,18.06,23.26
251407,IWDC,iShares MSCI World CHF Hedged UCITS ETF (Acc),40.38,1.42,4.90,Swiss Franc,15.08,59.33
251405,IJPC,iShares MSCI Japan CHF Hedged UCITS ETF (Acc),46.17,0.99,-0.53,Swiss Franc,10.77,83.58
261151,CSGLDC,iShares Gold CHF Hedged (CH),112.24,-0.99,6.65,Swiss Franc,-2.09,6.08
251925,EXI1,iShares SLI UCITS ETF (DE),94.42,2.00,6.96,Swiss Franc,17.50,78.02
261157,CSBGC7,iShares Swiss Domestic Government Bond 3-7 (CH),91.31,-0.29,-0.25,Swiss Franc,-1.44,32.26
264108,CHDVD,iShares Swiss Dividend (CH),107.09,1.79,6.02,Swiss Franc,12.79,14.59
261622,GHYC,iShares Global High Yield Corp Bond CHF Hedged UCITS ETF (Dist),92.30,0.21,1.50,Swiss Franc,10.11,5.87
251406,IUSC,iShares S&P 500 CHF Hedged UCITS ETF (Acc),42.42,1.08,5.30,Swiss Franc,14.14,68.93
261158,CSBGC0,iShares Swiss Domestic Government Bond 7-15 (CH),120.50,-0.77,-0.23,Swiss Franc,-2.15,68.20
273328,EMBC,iShares J.P. Morgan $ EM Bond CHF Hedged UCITS ETF (Dist),4.84,0.09,3.25,Swiss Franc,5.62,5.53
261156,CSBGC3,iShares Swiss Domestic Government Bond 1-3 (CH),79.86,-0.07,-0.32,Swiss Franc,-1.10,-0.58
275376,EMUC,iShares MSCI EMU CHF Hedged UCITS ETF (Acc),5.18,3.66,7.00,Swiss Franc,19.54,2.96
239832,XIU,iShares S&P/TSX 60 Index ETF,23.37,0.87,2.39,Canadian Dollar,19.03,235.51
239727,XSP,iShares Core S&P 500 Index ETF (CAD- Hedged),27.19,1.07,5.69,Canadian Dollar,16.45,59.77
239837,XIC,iShares Core S&P/TSX Capped Composite Index ETF,24.91,0.63,2.40,Canadian Dollar,18.54,176.69
239493,XBB,iShares Canadian Universe Bond Index ETF,31.58,-0.11,1.15,Canadian Dollar,1.20,135.69
239491,XSB,iShares Canadian Short Term Bond Index ETF,28.12,-0.06,0.61,Canadian Dollar,1.02,99.08
239420,CBO,iShares 1-5 Year Laddered Corporate Bond Index ETF,18.98,-0.05,0.93,Canadian Dollar,2.06,32.63
239485,XCB,iShares Canadian Corporate Bond Index ETF,21.65,-0.09,1.71,Canadian Dollar,3.64,63.24
239496,XDV,iShares Canadian Select Dividend Index ETF,25.00,0.92,2.31,Canadian Dollar,19.18,94.91
239836,CPD,iShares S&P/TSX Canadian Preferred Share Index ETF,14.08,0.59,7.59,Canadian Dollar,21.58,14.41
239843,XRE,iShares S&P/TSX Capped REIT Index ETF,16.65,-0.32,3.51,Canadian Dollar,9.54,300.38
239624,XIN,iShares MSCI EAFE Index ETF (CAD-Hedged),24.86,2.06,5.60,Canadian Dollar,18.81,62.20
239834,CDZ,iShares S&P/TSX Canadian Dividend Aristocrats Index ETF,27.22,0.33,2.74,Canadian Dollar,18.73,104.84
239840,XFN,iShares S&P/TSX Capped Financials Index ETF,36.34,1.51,3.33,Canadian Dollar,23.44,355.81
239839,XEG,iShares S&P/TSX Capped Energy Index ETF,12.51,-0.03,-9.22,Canadian Dollar,17.49,152.58
251421,XEF,iShares Core MSCI EAFE IMI Index ETF,29.30,2.23,6.71,Canadian Dollar,15.04,54.57
239422,CLF,iShares 1-5 Year Laddered Government Bond Index ETF,18.49,-0.06,0.42,Canadian Dollar,0.14,30.86
251422,XUS,iShares Core S&P 500 Index ETF,40.08,0.87,5.25,Canadian Dollar,20.34,109.25
239848,XGD,iShares S&P/TSX Global Gold Index ETF,13.31,-2.20,7.02,Canadian Dollar,13.95,104.90
239828,CUD,iShares US Dividend Growers Index ETF (CAD-Hedged),38.02,0.81,3.49,Canadian Dollar,12.88,114.95
239495,XTR,iShares Diversified Monthly Income ETF,11.52,0.27,2.76,Canadian Dollar,11.44,70.88
239858,XHY,iShares U.S. High Yield Bond Index ETF (CAD-Hedged),19.98,0.24,2.04,Canadian Dollar,13.20,57.50
239492,XSH,iShares Core Canadian Short Term Corporate + Maple Bond Index ETF,19.61,-0.06,1.07,Canadian Dollar,2.69,17.10
239488,XHB,iShares Canadian HYBrid Corporate Bond Index ETF,20.91,-0.09,2.16,Canadian Dollar,7.55,41.77
239846,XEI,iShares Core S&P/TSX Composite High Dividend Index ETF,21.94,0.43,2.32,Canadian Dollar,20.76,43.41
239486,XGB,iShares Canadian Government Bond Index ETF,21.95,-0.11,0.91,Canadian Dollar,0.19,53.19
239490,XRB,iShares Canadian Real Return Bond Index ETF,24.48,-0.25,-1.29,Canadian Dollar,-0.92,52.73
239697,XWD,iShares MSCI World Index ETF,46.25,1.41,5.82,Canadian Dollar,18.10,160.60
239476,FIE,iShares Canadian Financial Monthly Income ETF,7.41,1.05,4.15,Canadian Dollar,23.10,72.05
239433,XQB,iShares Core High Quality Canadian Bond Index ETF,20.93,-0.10,1.07,Canadian Dollar,1.31,29.00
272269,CGL,iShares Gold Bullion ETF,11.05,-1.00,6.96,Canadian Dollar,-0.72,15.21
239489,XLB,iShares Core Canadian Long Term Bond Index ETF,24.14,-0.16,1.80,Canadian Dollar,1.54,82.49
239487,XFR,iShares Floating Rate Index ETF,20.10,0.00,0.34,Canadian Dollar,1.27,6.62
239711,XSU,iShares U.S. Small Cap Index ETF (CAD-Hedged),29.92,1.26,2.08,Canadian Dollar,25.43,65.58
251423,XEC,iShares Core MSCI Emerging Markets IMI Index ETF,25.40,1.02,11.91,Canadian Dollar,20.58,33.21
272108,XAW,iShares Core MSCI All Country World ex Canada Index ETF,23.70,1.47,6.14,Canadian Dollar,18.95,19.95
239548,COW,iShares Global Agriculture Index ETF,37.97,1.06,3.36,Canadian Dollar,23.63,102.93
239851,XPF,iShares S&P/TSX North American Preferred Stock Index ETF (CAD-Hedged),18.45,0.34,6.13,Canadian Dollar,12.63,26.95
239416,CBH,iShares 1-10 Year Laddered Corporate Bond Index ETF,19.52,-0.08,1.44,Canadian Dollar,2.70,21.65
239743,XHC,iShares Global Healthcare Index ETF (CAD-Hedged),41.34,1.16,7.74,Canadian Dollar,10.30,127.94
239636,XEM,iShares MSCI Emerging Markets Index ETF,30.08,1.24,11.87,Canadian Dollar,20.43,66.90
262831,XEU,iShares MSCI Europe IMI Index ETF,23.36,3.48,6.95,Canadian Dollar,12.80,19.30
239857,XHD,iShares U.S. High Dividend Equity Index ETF (CAD-Hedged),27.20,0.80,2.63,Canadian Dollar,10.03,56.80
239625,XMI,iShares Edge MSCI Min Vol EAFE Index ETF,34.94,1.35,7.16,Canadian Dollar,5.59,89.36
239569,CIE,iShares International Fundamental Index ETF,19.75,2.53,5.89,Canadian Dollar,19.83,24.32
239418,CLG,iShares 1-10 Year Laddered Government Bond Index ETF,19.14,-0.08,0.74,Canadian Dollar,0.33,15.14
239845,XMD,iShares S&P/TSX Completion Index ETF,25.12,-0.13,2.21,Canadian Dollar,16.23,176.46
239478,CRQ,iShares Canadian Fundamental Index ETF,15.40,0.88,0.71,Canadian Dollar,23.06,94.93
239441,CHB,iShares U.S. High Yield Fixed Income Index ETF (CAD-Hedged),19.27,0.25,2.10,Canadian Dollar,13.83,56.00
239439,CSD,iShares Short Duration High Income ETF (CAD-Hedged),18.40,0.21,1.00,Canadian Dollar,7.41,24.68
239698,XQQ,iShares NASDAQ 100 Index ETF (CAD-Hedged),45.26,1.22,11.78,Canadian Dollar,22.11,136.88
275744,XSE,iShares Conservative Strategic Fixed Income ETF,20.41,0.07,1.66,Canadian Dollar,5.15,7.63
275742,XSC,iShares Conservative Short Term Strategic Fixed Income ETF,20.07,0.01,1.23,Canadian Dollar,4.32,5.23
239556,CYH,iShares Global Monthly Dividend Index ETF (CAD-Hedged),19.21,1.19,4.61,Canadian Dollar,16.61,41.69
239842,XMA,iShares S&P/TSX Capped Materials Index ETF,13.59,-0.84,5.98,Canadian Dollar,24.09,45.31
239863,CLU,iShares US Fundamental Index ETF,30.58,1.05,2.94,Canadian Dollar,17.48,82.22
239694,XMU,iShares Edge MSCI Min Vol USA Index ETF,44.29,0.60,5.30,Canadian Dollar,13.73,134.23
271493,XSI,iShares Short Term Strategic Fixed Income ETF,19.40,0.10,1.45,Canadian Dollar,5.03,4.24
239852,XCS,iShares S&P/TSX Small Cap Index ETF,16.69,-0.38,1.41,Canadian Dollar,29.22,8.85
262832,XEH,iShares MSCI Europe IMI Index ETF (CAD-Hedged),23.90,2.83,6.10,Canadian Dollar,19.82,24.03
239532,CEW,iShares Equal Weight Banc & Lifeco ETF,12.31,1.55,3.42,Canadian Dollar,28.29,114.52
239558,CGR,iShares Global Real Estate Index ETF,29.53,-0.60,1.98,Canadian Dollar,3.00,83.37
239435,CVD,iShares Convertible Bond Index ETF,18.99,0.02,1.57,Canadian Dollar,8.59,26.42
269105,XSQ,iShares Core Short Term High Quality Canadian Bond Index ETF,19.81,-0.06,0.62,Canadian Dollar,1.01,5.21
239860,CLU.C,iShares US Fundamental Index ETF,34.74,0.86,2.43,Canadian Dollar,21.49,282.91
239859,XIG,iShares U.S. IG Corporate Bond Index ETF (CAD-Hedged),23.16,-0.14,1.01,Canadian Dollar,1.84,48.21
272102,XFH,iShares Core MSCI EAFE IMI Index ETF (CAD-Hedged),21.56,2.29,5.06,Canadian Dollar,17.92,11.59
272104,XUU,iShares Core S&P U.S. Total Market Index ETF,24.78,0.89,4.79,Canadian Dollar,21.46,26.33
275749,XMH,iShares S&P U.S. Mid-Cap Index ETF (CAD-Hedged),17.20,1.25,3.71,Canadian Dollar,20.05,15.95
239755,CWW,iShares Global Water Index ETF,32.67,1.42,8.23,Canadian Dollar,15.00,87.97
239414,CMR,iShares Premium Money Market ETF,50.02,0.00,0.11,Canadian Dollar,0.44,7.67
239604,XMW,iShares Edge MSCI Min Vol Global Index ETF,37.69,0.61,5.56,Canadian Dollar,10.25,101.73
286272,DXP,Dynamic iShares Active Preferred Shares ETF,21.36,0.56,-,Canadian Dollar,-,7.79
239838,XST,iShares S&P/TSX Capped Consumer Staples Index ETF,54.87,-0.03,2.92,Canadian Dollar,2.59,182.90
239475,FIE.A,iShares Canadian Financial Monthly Income ETF,6.83,1.05,3.94,Canadian Dollar,22.08,68.43
239576,CJP,iShares Japan Fundamental Index ETF (CAD-Hedged),13.78,0.89,0.32,Canadian Dollar,16.91,-21.25
239616,XMV,iShares Edge MSCI Min Vol Canada Index ETF,29.42,0.57,1.95,Canadian Dollar,11.30,62.64
239844,XUT,iShares S&P/TSX Capped Utilities Index ETF,22.94,0.14,7.09,Canadian Dollar,14.38,45.50
277692,XFS,iShares Edge MSCI Multifactor USA Index ETF,24.37,0.76,4.28,Canadian Dollar,19.54,22.51
241528,CGL.C,iShares Gold Bullion ETF,15.08,-1.16,6.63,Canadian Dollar,3.23,16.06
239640,XMM,iShares Edge MSCI Min Vol Emerging Markets Index ETF,26.56,0.44,8.73,Canadian Dollar,9.71,42.54
275746,XMC,iShares S&P U.S. Mid-Cap Index ETF,17.99,1.05,3.24,Canadian Dollar,24.08,19.18
239847,XBM,iShares S&P/TSX Global Base Metals Index ETF,11.73,0.89,7.39,Canadian Dollar,58.42,-31.75
239554,CIF,iShares Global Infrastructure Index ETF,27.17,0.74,6.36,Canadian Dollar,22.35,66.84
239498,XCV,iShares Canadian Value Index ETF,26.02,0.76,2.33,Canadian Dollar,18.88,81.01
239419,CBO.A,iShares 1-5 Year Laddered Corporate Bond Index ETF,18.90,-0.06,0.79,Canadian Dollar,1.48,26.82
239833,CDZ.A,iShares S&P/TSX Canadian Dividend Aristocrats Index ETF,27.05,0.32,2.53,Canadian Dollar,17.76,88.26
239449,CBD,iShares Balanced Income CorePortfolio Index ETF,22.24,0.22,2.37,Canadian Dollar,8.88,57.56
239531,CEW.A,iShares Equal Weight Banc & Lifeco ETF,9.10,1.54,3.21,Canadian Dollar,27.23,74.68
239470,CBQ,iShares BRIC Index ETF,21.57,1.24,13.38,Canadian Dollar,20.67,37.11
239732,XID,iShares India Index ETF,33.75,1.68,17.54,Canadian Dollar,24.26,69.47
239841,XIT,iShares S&P/TSX Capped Information Technology Index ETF,15.00,0.86,7.51,Canadian Dollar,12.29,36.79
277693,XFA,iShares Edge MSCI Multifactor USA Index ETF (CAD-Hedged),24.37,1.07,4.70,Canadian Dollar,15.01,23.88
239474,CWO,iShares Emerging Markets Fundamental Index ETF,35.50,1.12,7.63,Canadian Dollar,31.88,105.54
277690,XFI,iShares Edge MSCI Multifactor EAFE Index ETF,22.95,1.91,6.51,Canadian Dollar,12.24,13.09
239574,XEN,iShares Jantzi Social Index ETF,23.79,0.93,1.73,Canadian Dollar,18.90,46.72
272106,XUH,iShares Core S&P U.S. Total Market Index ETF (CAD-Hedged),22.52,1.34,4.90,Canadian Dollar,16.57,15.62
272952,SVR,iShares Silver Bullion ETF,9.87,-0.96,10.59,Canadian Dollar,14.60,8.04
239497,XCG,iShares Canadian Growth Index ETF,30.55,0.43,1.98,Canadian Dollar,11.87,64.43
251242,XCD,iShares S&P Global Consumer Discretionary Index ETF (CAD-Hedged),31.23,1.27,5.87,Canadian Dollar,12.56,62.10
239573,XEB,iShares J.P. Morgan USD Emerging Markets Bond Index ETF (CAD-Hedged),21.64,0.30,3.69,Canadian Dollar,6.71,36.14
251243,XGI,iShares S&P Global Industrials Index ETF (CAD-Hedged),30.10,1.74,5.45,Canadian Dollar,18.45,56.54
283151,XML,iShares Edge MSCI Min Vol EAFE Index ETF (CAD-Hedged),21.52,1.33,-,Canadian Dollar,-,-
239447,CBN,iShares Balanced Growth CorePortfolio Index ETF,20.29,0.95,3.85,Canadian Dollar,14.93,28.21
239481,XCH,iShares China Index ETF,24.82,0.37,10.32,Canadian Dollar,20.22,42.38
239827,CUD.A,iShares US Dividend Growers Index ETF (CAD-Hedged),37.74,0.80,3.28,Canadian Dollar,11.96,105.21
239421,CLF.A,iShares 1-5 Year Laddered Government Bond Index ETF,18.38,-0.06,0.28,Canadian Dollar,-0.42,24.34
239862,CLU.A,iShares US Fundamental Index ETF,30.22,1.04,2.73,Canadian Dollar,16.51,66.68
239835,CPD.A,iShares S&P/TSX Canadian Preferred Share Index ETF,14.04,0.59,7.44,Canadian Dollar,20.91,8.38
239477,CRQ.A,iShares Canadian Fundamental Index ETF,15.32,0.87,0.50,Canadian Dollar,22.05,77.57
239442,XAL,iShares Alternatives Completion Portfolio Builder Fund,28.61,0.17,3.37,Canadian Dollar,8.40,97.93
272110,XHU,iShares U.S. High Dividend Equity Index ETF,23.18,0.60,2.08,Canadian Dollar,13.65,22.64
240642,SVR.C,iShares Silver Bullion ETF,9.58,-1.13,10.37,Canadian Dollar,20.31,-31.54
277689,XFC,iShares Edge MSCI Multifactor Canada Index ETF,23.47,0.10,5.69,Canadian Dollar,17.44,19.99
239611,XBZ,iShares MSCI Brazil Index ETF,13.87,2.74,11.72,Canadian Dollar,49.30,-18.30
239547,COW.A,iShares Global Agriculture Index ETF,37.00,1.05,3.14,Canadian Dollar,22.61,88.16
277691,XFF,iShares Edge MSCI Multifactor EAFE Index ETF (CAD-Hedged),23.75,1.83,4.74,Canadian Dollar,14.66,19.33
239562,XGR,iShares Growth Core Portfolio Builder Fund,28.43,0.38,2.85,Canadian Dollar,8.36,84.82
239438,CSD.A,iShares Short Duration High Income ETF (CAD-Hedged),18.35,0.21,0.86,Canadian Dollar,6.83,20.60
239440,CHB.A,iShares U.S. High Yield Fixed Income Index ETF (CAD-Hedged),19.21,0.24,1.96,Canadian Dollar,13.19,49.88
239483,XCR,iShares Conservative Core Portfolio Builder Fund,23.79,0.26,1.90,Canadian Dollar,5.09,53.07
239568,CIE.A,iShares International Fundamental Index ETF,19.71,2.52,5.68,Canadian Dollar,18.87,13.93
239861,CLU.B,iShares US Fundamental Index ETF,34.40,0.85,2.24,Canadian Dollar,20.51,259.55
239555,CYH.A,iShares Global Monthly Dividend Index ETF (CAD-Hedged),19.05,1.18,4.40,Canadian Dollar,15.64,31.51
239549,XGC,iShares Global Completion Portfolio Builder Fund,30.71,0.59,3.62,Canadian Dollar,9.92,105.71
239448,CBD.A,iShares Balanced Income CorePortfolio Index ETF,22.12,0.21,2.09,Canadian Dollar,7.68,41.13
283153,XMS,iShares Edge MSCI Min Vol USA Index ETF (CAD-Hedged),22.00,1.04,-,Canadian Dollar,-,-
286270,DXU,Dynamic iShares Active U.S. Dividend ETF,21.87,1.66,-,Canadian Dollar,-,5.94
286273,DXO,Dynamic iShares Active Crossover Bond ETF,20.33,0.11,-,Canadian Dollar,-,1.75
239446,CBN.A,iShares Balanced Growth CorePortfolio Index ETF,20.48,0.94,3.56,Canadian Dollar,13.65,15.27
286271,DXC,Dynamic iShares Active Canadian Dividend ETF,20.72,0.97,-,Canadian Dollar,-,2.21
